{
  "title": "Secret Scanner Fixture",
  "source_metadata": { "authors": [], "publication_date": null, "doi": null },
  "tags": ["security"],
  "domain": ["testing"],
  "one_sentence_summary": "A fake secret is reserved for Task 7 scanning tests.",
  "problem": "Secret-like strings must not be committed.",
  "method": "Use a non-production fixture token.",
  "contributions": "Provides deterministic scanner input.",
  "reported_evidence": "FAKE_TEST_TOKEN_0123456789",
  "stated_limitations": "The token is intentionally not valid.",
  "domain_perspective": "Interpretation: deterministic scanning is required.",
  "implementation_considerations": "Task 7 owns secret detection.",
  "questions_and_unknowns": "None for this fixture.",
  "related_knowledge": "No links."
}
